{
  "schema_version": "1",
  "set_id": "v1",
  "parent": null,
  "note": "Placeholder assumptions for the F1 twin (public layout, synthetic hydraulics). Not ACUD data. Every value is unverified.",
  "assumptions": {
    "water_production_cost": {
      "unit": "EGP/m3",
      "distribution": {
        "type": "triangular",
        "min": 5.0,
        "mode": 8.0,
        "max": 12.0
      },
      "source_note": "Placeholder",
      "verified": false
    },
    "min_service_pressure": {
      "unit": "m",
      "distribution": {
        "type": "triangular",
        "min": 12,
        "mode": 15,
        "max": 20
      },
      "source_note": "Placeholder",
      "verified": false
    }
  }
}
